Date,Title,Articles
Feb 21 2025 9:30 AM ,Oil Prices Slide After Streak of Gains,"Oil is set to close out the week with a gain, marking the first upside for crude since mid-January.


Friday, February 21, 2025 The Tuesday drone attack on the CPC pipeline, Kazakhstan’s key export conduit, has set a bullish tone for this week with four straight daily gains and ICE Brent trending around $76 per barrel. In the United States, rising oil inventories were largely offset by distillate stocks slipping below the 5-year range. Overall, the average February Brent price of $75.50 per barrel is exactly where the current mood lies, indicating a stagnant short-term view. Trump Expedites Water Permits Across US. Citing its own ‘energy emergency’, the Trump administration has decided to fast-track some 700 water permits across the US, including a tunnel for Enbridge’s Line 5 pipeline, dredging for the Elba Island LNG project and repairs at Sabine Pass LNG. EU to Slap Sanctions on Russian Aluminium. EU member countries agreed on the 16th sanctions package against Russia, including a ban on primary aluminium imports, sales of gaming consoles to Russia as well as adding 73 so-called shadow fleet tankers to Brussels’ list of sanctioned ships. 


Oil and Biofuels Industries Join Forces on Mandates. The US oil industry, represented by the API, and biofuel interest groups joined ranks in demanding higher renewable biofuel mandates from 2026 and beyond, leaving behind decades of disputes as they jointly oppose the proliferation of EVs.Russia Extends Gasoline Export Ban. Following a string of recent Ukrainian refinery drone strikes that culminated with this week’s attack on the 150,000 b/d Syzran refinery, Russia’s Energy Ministry has extended its gasoline export ban for another six months starting in March, exempting only producers.Related: U.S. and Ukraine Discuss Critical Minerals DealUS Oil Major Eyes Chile’s Lithium Bounty. US oil major ExxonMobil (NYSE:XOM) is reportedly meeting Chilean government officials over the upcoming weeks, expressing interest in developing lithium projects in the country as it sees parallels between conventional drilling and direct lithium extraction.    Barrick Ends Months-Long Mali Dispute. Canada’s gold mining giant Barrick Gold (NYSE:GOLD) signed a new deal with the Malian government over its projects in the West African country, ending a two-year dispute that involved employee arrests and paying $438 million to Bamako as compensation. Saudi Aramco Seeks New Retail Markets. Saudi national oil company Saudi Aramco (TADAWUL:2222) has agreed to purchase a 25% stake in Philippine fuel retailer Unioil, marking its return to the East Asian market, some 17 years after it sold its 40% stake in the country’s only refiner Petron. Oxy Ends Years of Profits with Q4 Loss. Dragged lower by weak chemical and midstream results, US oil major Occidental Petroleum (NYSE:OXY) posted a rare loss of $297 million in Q4 2024 after the Houston-headquartered firm allocated $1.1 billion to an environmental liability increase that it disputes in court. Brazil Launches Giant Licensing Round. Brazil’s oil and gas regulator ANP has opened up 332 blocks in both onshore and offshore basins as part of its next licensing bid round, with licences to be offered as concession contracts with lower royalty rates to finally bolster waning exploration activity. Midstream Developers Mull New Deepwater Port. Coming only days after Enterprise (NYSE:EPD) shelved its SPOT project, US midstream firm Sentinel Midstream announced that it intends to take a final investment decision on its Texas GulfLink deepwater port in Freeport, the first onshore port to load a VLCC.Mystery Tanker Attacks Scare Shippers. Four tankers have been hit with inexplicable explosions in 2025 to date, with Greek shipper Thenamaris reporting an incident this week with a blast on its Seajewel tanker docked in Italy’s Savona, all linked by the ships sailing to Russian ports prior to being attacked.South Korea to Build Two New Nuclear Plants. The government of South Korea finalized a new energy strategy that should lift the share of nuclear energy in the country’s energy mix to 35.2% in 2038 from 30.7% last year, envisaging the construction of two additional large-scale plants with 3.5 GW capacity. Colombia Posts Much-Needed Reserve Boost. Colombia’s state oil firm Ecopetrol (NYSE:EC) reported 260 million barrels of new reserves discovered in 2024, finally posting a positive reserve replacement ratio of 104%, however, the 1.88 billion boe in its portfolio still equals only 7.6 years of consumption.Tariff Fears Lift Gold to Another Record. Trump’s latest tariff-slapping frenzy that put cars and semiconductors at the forefront of discussion has triggered another rally in gold prices, with the bullion hitting an all-time high of $2,955 per ounce this week and being up 12% since the beginning of 2025.By Michael Kern for Oilprice.com

More Top Reads From Oilprice.comU.S. Refiner HF Sinclair Swings To Loss as Margins ShrinkNatural Gas Prices Surge As Arctic Blast Fuels DemandUK Announces Plans to Accelerate Clean Energy Rollout"
Feb 20 2025 7:00 PM ,AI Data Centers Bet on Next-Gen Nuclear,"Soaring demand for electricity to power the AI boom is creating a global rush to develop small modular reactors to meet the growing energy needs of the Big Tech firms with electricity that’s both reliable and low-carbon.Many start-ups in the United States and Europe are vying to become the first to not only design but also put into commercial operation the next generation of advanced nuclear reactors.


The small modular reactors (SMR) are believed to be simpler and cheaper to build and install. Because of their smaller size, it is possible to install SMRs on sites that are not suitable for bigger reactors. They are also significantly cheaper and faster to build than conventional reactors and can be constructed incrementally to meet the growing energy demand of a site.Nuclear Renaissance Despite promising advances in recent years, no one has actually launched such a micro reactor yet. However, the race has accelerated as technology giants are looking to power and cool their data centers, preferably with low-carbon energy. Renewables plus battery storage cannot meet all the growth in demand, so nuclear power has become the next best thing for Big Tech who are looking to boast AI advancements and climate commitments at the same time.The problem is that conventional nuclear reactors and sites take years, often decades, to fund and build.One mothballed reactor is being restarted in the U.S., thanks to a power purchase agreement that giant Microsoft has signed.Last year, Constellation Energy, the biggest owner of U.S. nuclear power plants, signed its largest-ever power purchase agreement with Microsoft, which paves the way for the restart of the Three Mile Island Unit 1 nuclear plant.The tech industry, however, cannot rely on PPAs from operational nuclear reactors to cover the energy needs of their new data centers. That’s why Big Tech is investing in the start-ups that are developing smaller-scale modular reactors.Big Tech Backs Advanced Nuclear Technology Amazon, for example, invested in a financing round of approximately $500 million, which X-Energy Reactor Company raised last year. X-Energy continues to raise financing to complete its reactor design and licensing as well as the first phase of its TRISO-X fuel fabrication facility in Oak Ridge, Tennessee. The Amazon funding will support future carbon-free projects that will use X-energy’s Xe-100 advanced SMRs.  Related: Kazakh Oil Output Hits Record High“We need smart solutions that can help us meet growing energy demands while also addressing climate change,” said Kevin Miller, Amazon’s Vice President of Global Data Centers.Earlier this month, X-Energy said that the upsized $700 million financing round would help it advance its technology development. Amazon and X-energy are collaborating to bring more than 5 gigawatts (GW) of new power projects online across the U.S. by 2039.


Another tech giant, Google, signed in October 2024 the world’s first corporate agreement to purchase nuclear energy from multiple small modular reactors to be developed by Kairos Power.“This agreement is part of our efforts to develop and commercialize a broad portfolio of advanced clean electricity technologies to power our global data centers and offices,” Michael Terrell, Senior Director, Energy and Climate, at Google said.In the race to commercialize the first small modular reactors, developers globally have raised at least $1.5 billion in funding over the past year to advance their technologies and projects, according to estimates by the Financial Times.Race Heats UpThe funding rounds, in many cases backed by the technology giants, add to government support for nuclear technologies in the U.S. and Europe.While the Trump Administration is skeptical about supporting renewables such as solar and wind, and especially offshore wind, the Department of Energy strongly backs nuclear power development.Secretary of Energy Chris Wright said earlier this month that DOE would “work diligently and creatively to enable the rapid deployment and export of next-generation nuclear technology.”  The funding and the support are lining up for developers of small advanced reactors. However start-ups will need much more financing to commercialize the various advanced nuclear technologies they are currently designing.The hope is that at some point in the 2030s, the world will have its first operational small modular reactor. Developers and backers also hope that SMRs will not suffer the fate of many conventional nuclear projects of recent years, which have seen huge cost overruns and have been years behind schedule.Nuclear Power To Help Meet The AI Power Demand A lot of nuclear energy will be needed in the coming years as data center demand is soaring.Nuclear power will be one of the most important new energy infrastructure that the world will need to meet the electricity demand from AI, Goldman Sachs said in a report last month.“But nuclear can’t meet all of the increased data-center power needs. Natural gas, renewables, and battery technology will also have a role to play,” Goldman Sachs Research said.The Wall Street bank forecasts 85-90 GW of new nuclear capacity would be needed to meet all of the data center power demand growth expected by 2030, relative to 2023. But well less than 10% of this capacity will be available globally by 2030.That’s why natural gas will stay in the mix, especially in the U.S., while battery storage capacity is also expected to surge to back up solar and wind power in unfavorable weather conditions, according to Goldman Sachs.By Tsvetana Paraskova for Oilprice.com

More Top Reads From Oilprice.comIndia Reshuffles Trade to Circumvent Russian Oil SanctionsU.S. Refiner HF Sinclair Swings To Loss as Margins ShrinkNatural Gas Prices Surge As Arctic Blast Fuels Demand"
Feb 20 2025 11:00 AM ,Americans Brace for Higher Prices at the Pump,"Despite President Trump’s promise he’d bring down energy prices, Americans should brace for higher gasoline prices amid seasonal maintenance at refineries and outages on the West Coast. Yet even higher, prices are down compared to a year ago.“The national average has inched higher, driven primarily by sharp gas price increases on the West Coast, where refinery maintenance and outages have created a ripple effect in neighboring states, pushing prices higher in many communities,” GasBuddy’s head of petroleum analysis, Patrick De Haan wrote in a report this week, which warned about the spread of higher prices across regions.


“Although the surge remains isolated to the West for now, refinery maintenance will soon begin in other regions, and with the transition to summer gasoline blends underway, prices in most areas are likely to start rising in the weeks ahead,” De Haan also wrote.Typically, gasoline prices are at their lowest in early February, before refinery maintenance begins. Once it does, prices tick higher due to the temporary supply constraints. Then, in March and April, refineries begin to switch to producing summer fuel blends – these evaporate less easily than winter blends as the latter need to be suitable for use in colder weather. Driving season is also peak demand season, which tends to be conducive to higher prices at the pump. Yet the effects of this year’s seasonal supply and demand dynamics may be limited, according to analysts.Related: Goldman Sachs: Ukraine Peace Won’t Hike Russia’s Oil SupplyWhile refineries enter maintenance, “oil prices remain subdued in the low $70s as President Trump works on a potential peace deal between Russia and Ukraine — an event that, if realized, could have significant implications for oil markets in the months ahead,” GasBuddy’s De Haan wrote.On the other hand, Goldman Sachs does not expect a potential ceasefire or a peace deal for Ukraine to boost Russian oil production in any substantial way, limiting the effect on prices, at least in terms of physical market balance.“We believe that Russia crude oil production is constrained by its OPEC+ 9.0 million barrels per day (mbpd) production target rather than current sanctions, which are affecting the destination but not the volume of oil exports,” analysts at Goldman Sachs wrote in a note this week.


However, the lifting of U.S. sanctions would make moving Russian oil around the world cheaper, effectively bringing prices lower, as noted by Bank of America analysts also this week: “Should sanctions relief allow it, we believe Brent crude oil prices could drop between $5 and $10/bbl if Russian barrels suddenly do not need to make a long journey to India or China, and more supply is suddenly made available,” they said.Geopolitics, then, should help push American prices at the pump lower or, at the very least, limit their increase during peak demand season when gas stations sell the more expensive summer fuel blends. Yet this is not the case all around. California, for one, has cemented its position as the most expensive state to drive in, with prices up by $0.41 per gallon in just the last month and $0.20 per gallon higher than a year ago, at $4.85 per gallon, according to Yahoo Finance. California piles a mass of energy transition-related taxes on fuels sold in the state.For the rest of the country, however, there is good gas price news down the road, regardless of the geopolitical situation. “US gas price averages will largely be well below $3 per gallon in the last third of 2025 unless we see a hurricane impact the US Gulf Coast,” the global head of energy analysis at OPIS, Tom Kloza, told Yahoo Finance.By Charles Kennedy for Oilprice.com

More Top Reads From Oilprice.comBrazil Joins OPEC+Trump's No-Prisoners Approach to Iran-China Oil CrackdownU.S. Fuel Prices Surge On Refinery Maintenance And Outages"
Feb 20 2025 1:00 PM ,Is the Era of Net Zero Pledges Coming to an End?,"Just a few short years ago BP proudly told us they were embarking on a journey – and I quote – “in support of our purpose to reimagine energy for people and our planet, and our ambition to become a Net Zero company by 2050 or sooner and help the world get to Net Zero.”This week, the oil giant revealed a sizeable slump in profits and its new chief executive had vowed to deliver “a fundamental reset”.So what’s going on? Is Net Zero falling out of fashion?As recently as 2020 BP’s annual report was dripping with feel-good sentiment about a clean energy future – in tone and design it looked more like an advert for Innocent smoothies.The firm was unambiguous; their future wasn’t in being an International Oil Company but an Integrated Energy Company. With massively ambitious plans to ramp up and up their investment in renewable energy they said that this journey will, and I quote, “require patience but will, over time, create a more valuable company for its shareholders…”


But it hasn’t worked out like that. Bernard Looney, the CEO who wanted to lead this journey has gone and his successor has been left to survey the wind turbine dotted landscape and it’s not that pretty.The company just reported a significant profit slump and a decline in revenues and the boss has now promised to deliver “A new direction for BP” – so which direction will it go in?Well, if investor Elliot Management has anything to do with it, it probably won’t be towards a clean, green future.The activist hedge fund has taken a near 5 per cent stake in the oil giant worth almost £4bn and is understood to be pushing BP to massively row back on its green investment strategy, focusing more on, well, oil and gas. Analysts cite rival Shell as an example of the wisdom of this approach, with its current CEO having reversed many of the Net Zero pledges made by his predecessor. Shell’s shares have risen sharply since the new broom came in and the business is now worth north of £160bn in contrast to BP’s £75bn valuation.This all comes at a time when the mantra in America is “Drill baby drill” – with Donald Trump promising a new golden age for American energy. Meanwhile in the UK, the government continues to insist that Net Zero is both vitally important and eminently achievable – but its biggest cheerleader, Ed Miliband, is being forced to swallow policies that rub up against this commitment – not least the expansion of Heathrow which has climate activists up in arms or up trees or doubtless, before too long, sitting in the middle of motorways again.Politically, Nigel Farage and Reform UK sense a major opportunity to make the pursuit of Net Zero a huge wedge issue and at a speech in the City earlier this week the insurgent party – which now tops the polls – said they would scrap Net Zero, calling the objective “stupid” and pledging to tax wind and solar farms out of existence. They said they were “serving notice” on the renewables industry.Now, make of this what you will, but here at City AM we’ve been inundated with pitches for comment pieces seeking to remake the case for Net Zero. A lot of people are trying to get on the front foot in this debate, making the argument that Net Zero and economic growth go hand in hand – and we’ve given space to that argument – but we’ve also given space to voices warning that while the policy itself isn’t necessarily daft, the binding targets and ‘reach it at all costs’ approach to achieving the holy grail of Net Zero is hard to justify and will come at a high cost.It’s good that we’re having the debate; policies of this magnitude and impact need to be probed, adjusted, debated. It’s clear where energy policy is moving, it’s clear where technology is going to be transformative…and of course environmental concerns aren’t dead – they’re not even dead at the major oil companies, they’re just coming up against reality. 


Now, speaking of reality – time to consider Rachel Reeves.You know it’s been a tough week for the Chancellor when the best thing that happened to her was the UK marginally, technically avoiding a recession. The latest GDP figures pointed to economic growth of 0.4 per cent in December meaning Q4 2024 was… basically flat.Stagnant is another word for it. December’s growth figure does, however, bring some modest relief to the government though it should be noted that the growth in question was pretty much driven by strong trading in pubs, bars and restaurants – Christmas, in other words, and it masks a grim reality that GDP per head fell in the final three months of the year.Economists are clear that the outlook is still deeply concerning – and as if we needed any more evidence of this the latest figures released today show that hiring continues to slump, vacancies are down, employers are braced for higher costs and regulations coming online in April – all of which will make the debate about the accuracy of Rachel Reeves’ CV feel like a comedy interlude. By City AM 

More Top Reads From Oilprice.comU.S. Refiner HF Sinclair Swings To Loss as Margins ShrinkAbu Dhabi's ADNOC to Boost Liquidity of Gas BusinessU.S. Intelligence Reports Heightened Risk of Israeli Strike on Iran"
