Date,Title,Articles
Feb 11 2025 2:00 PM ,Global Markets React to Escalating U.S.-China Trade Tensions,"Via Metal MinerThe so-called “Trump Tariffs” imposed by U.S. President Donald Trump caused uncertainty in the global metals market earlier in the week. Though he did pause imposing tariffs on goods from Mexico and Canada for one month, there could still me plenty more chaos down the road.


The current tariffs include a 25% levy on goods from Canada and Mexico, as well as a 10% levy on imports from China. But in a tit-for-tat move, China responded by imposing a 15% tariff on the import of U.S. coal and liquefied natural gas on Tuesday.This came alongside additional 10% tariffs on crude oil, farm equipment and some autos. According to reports, those levies will go into effect starting February 10. For now, markets and buyers have little else to do but watch and wait.Trump Tariffs Hit Global Markets, Lead to Swift RetaliationAccording to Reuters, China’s Commerce Ministry and Customs Administration separately announced export controls on key metals essential for electronics, military equipment and solar panels. Meanwhile, China’s newly announced 10% tariff on U.S.-made electric trucks could impact future sales of Elon Musk’s Cybertruck, a niche Tesla offering the brand is currently promoting across China.Experts are near-unanimous that there would be a far-reaching fallout of both the Trump tariffs and the subsequent retaliations. Many agree that the effects will impact base metal prices, trade dynamics and even global economic stability to an extent. When markets opened Monday, base metal prices on the London Metal Exchange saw a significant drop, while the prices of metals like zinc, copper and steel also traded lower. Gold Had a Good Day in Response to TariffsThere was at least one metal that managed to move north. Gold prices topped their all-time high on February 3, 2025, following concerns of inflation hurting the U.S. economy. Reuters reported that spot gold rose 0.8% to $2,818.99 per ounce by 01:45 p.m. ET after hitting a record of $2,830.49 earlier in the session. Meanwhile, U.S. gold futures settled 0.8% higher at $2,857.10.In the wake of the tariffs, fears of a new global trade war also adversely affected metal and mining company stock prices on some of the global stock exchanges. All of this only serves to underline the volatility that such tariff announcements can introduce to worldwide commodities markets. l Tariffs Affect China?Compared to his first time period as U.S. President, experts say Trump has been a bit kinder to Beijing this time, leaving the room open for further negotiations. Still, the imposition of tariffs could affect global markets in several key ways.


Exports – A percentage of China’s metal exports remain earmarked for the U.S., meaning Beijing will now have to find alternate markets.Production Costs – Increased tariffs mean more costs for manufacturers who rely on these metals for production. This, in turn, may result in higher consumer prices.Market Dynamics – Price cuts brought on by Trump tariffs could negatively impact Chinese metal producers by squeezing their profit margins.While China is still emerging from a long holiday due to the New Year, its commerce ministry has countered the U.S. administration’s move by promising “corresponding countermeasures.” The ministry announced that it would be filing a complaint with the World Trade Organization in addition to announcing retaliatory tariffs.Still, as one of the biggest consumers and producers of metals like steel and aluminum, China will certainly see impacts from the U.S. president’s decision. Analysts Predict Widespread Economic EffectsMany experts believe that the impact of the tariffs will not be limited to China alone, but will broadly bruise global trade dynamics, particularly in North America. Nearly 75% of annual exports from Canada and Mexico are to the U.S., including for metals like copper, aluminum and zinc.America also relies quite a bit on the import of auto parts from these two countries. The retaliatory measures and tariffs are bound to push costs for manufacturers in the U.S., particularly for automobiles. If companies decide to pass these increased costs on to consumers, it will have a negative impact on inflation. Most experts anticipated China’s counteroffensive to Trump tariffs. The main question on everyone’s mind was how strong the retaliation will be. An earlier report by CNN.com stated that the prevailing belief in China was that Trump might be waiting for the results of a broader investigation into U.S.-China economic and trade relations, which he initiated through an executive order on his first day in office.China Has Already Redirected Some ExportsA report in the South China Morning Post quoted economists from ING as saying that the initial 10% Trump tariffs would have a “very modest” impact on China’s economic growth. However, they noted it would further pressure low-margin exports to the U.S. and likely push some out of the market. These experts also pointed out that sectors most at risk are those with readily available alternatives, such as textiles, certain electronics and machinery.However, with tariffs in place for the past seven years, companies have already redirected many price-sensitive and easily replaceable exports to other markets. In fact, some experts believe that China will start shifting some of its metal exports meant for the U.S. to other nations. What effect the new Trump Tariffs may have on this remains a mystery.By Sohrab Darabshaw

More Top Reads From Oilprice.comIndia Set to Launch New Oil and Gas Bid RoundsRussia Says Sanctions Shouldn’t Hinder Oil Trade With IndiaUK's Post-Brexit Trade Strategy Focuses on India and Australia"
Feb 10 2025 5:00 PM ,EU Braces for Impact as Trump Targets Trade,"European companies are trying to prepare for the fallout from President Donald Trump’s tariffs-first approach to trade policy as he finally finds the time to turn his attention to the EU after two quick wins with Canada and Mexico.Trump has threatened to slap tariffs on all imports from the European Union as a way of fixing what he deems an unfair trade surplus in the EU’s favor. According to European business executives, the impact of such a move could be quite serious, the Financial Times reported last week as investment banks start revising down their economic growth forecasts for the EU.


Per the FT, Germany’s power utility RWE, for instance, worried about its investment plans for the United States, with chief executive Markus Krebber saying it might need to tweak new wind and solar projects for the U.S. because some of the components it planned to use for these projects were not manufactured locally and would need to be imported from Europe.Other companies, including luxury goods maker LVMH and supermajor Shell were considering an expansion in the United States in response to the tariffs, likely with a view to hedging against the worst of the tariff fallout. “The big question is what happens if those tariffs come in between the US and Europe,” the chief executive of Volvo Cars told the Financial Times, elaborating that anything higher than 10% would force the carmakers to boost its production in the U.S.Related: Why Tesla Sales are PlummetingNone of this sounds like a bad thing for Trump and his effort to encourage more made-in-America action. It does sound like a pretty bad thing for the European Union, at least according to banks forecasting economic growth. Goldman Sachs said the eurozone’s GDP growth could suffer setbacks, resulting in feeble growth of 0.7% this year. This compares with the 1.1% growth forecast by the European Central Bank in December.It could end up being even worse if the EU retaliates in full, according to the chief European economist of the bank. In such a scenario, which is not at all unlikely, Sven Jari Stehn foresees a full percentage point wiped out of the eurozone’s economic growth, potentially plunging the eurozone into recession.Meanwhile, the EU is preparing for retaliation—even as it makes early concessions to Trump. The Financial Times again reported that the EU was prepared to offer Washington a lower import tariff for American cars, from 10% currently to a figure closer to the 2.5% that the United States charges on car imports. That would be in addition to the EU agreeing to buy more American liquefied natural gas and military equipment.


Indeed, the EU is already buying all the U.S. LNG it can find and then some. Last month almost 90% of all U.S. exports of liquefied natural gas ended up in Europe, Reuters reported earlier this month, citing data from LSEG. The U.S. total for the month came in at 8.46 million tons, of which 7.25 million tons were shipped to Europe amid typical winter weather and plummeting storage levels due to a lack of pipeline supplies from Russia.LNG was always going to be a focal point of any trade negotiations and an easy one for the Europeans to “fix”—they already have precious few alternative options, given political animosity towards Russian gas and calls for a ban. However, the EU would need to change its tack if it wants to secure future supply—with long-term commitments.This is what the chief executive of TotalEnergies said last week in comments on EU-U.S. trade and the outlook for the bloc’s energy security. Citing the unpredictability of the global trade environment, Patrick Pouyanne urged the EU to secure supply guarantees from the U.S., pointing out, “But what happens if all of a sudden the U.S. decides they must export less than they've done historically? ... We must not pass from a so-called over-dependence on Russia to an over-dependence on another country, even if it's an ally,” as quoted by Reuters.A long-term import commitment for U.S. LNG would please Trump, no doubt, but it would be problematic for EU leaders to admit they need such a commitment for the energy security of the bloc—because of all the talk about gas being easy to give up in favor of wind and solar. The last couple of months have proven empirically this is not the case, but it would still be difficult for the political class of the EU to acknowledge that as it prepares to hit Big Tech with trade restrictions in response to Trump’s tariff plans.While the EU mulls its response to the tariff threat, Trump just went and slapped 25% tariffs on all steel and aluminum imports, including from Mexico and Canada—and from the European Union. The EU would need to think faster on its feet and maybe forego retaliation for the time being—Trump has proven he can escalate quickly and sharply.By Irina Slav for Oilprice.com

More Top Reads From Oilprice.comRussia’s Crude Output Dips Below OPEC+ TargetOver 60% of IRA Investments Now At Trump’s MercyTesla Sales Fell 59% In Germany In January"
Feb 10 2025 11:00 AM ,Breakaway Moldovan Region To Buy Gas Backed By Russian Loan,"Transdniestria, a breakaway pro-Russian region of Ukraine's neighbour Moldova, has agreed on a deal with a Hungarian company to buy natural gas under a loan provided by Russia. Transdniestrian leader Vadim Krasnoselsky revealed in Telegram that the delivery of gas ""was made possible by Russian credit and functional support,"" though he did not provide further details. Moldovan Prime Minister Dorin Recean says his country will not block gas flows to Transndniestria under a deal involving Hungary's MET Gas and Energy Marketing AG.


Last month, the pro-Russian region was plunged into a crisis after Russian gas exports via pipelines running through Ukraine came to a halt on New Year's Day, cut off heating and hot water supplies to households. Local energy company Tirasteploenergo urged residents to use electric heaters, dress warmly, and hang blankets or thick curtains over windows and balcony doors.


Transdniestria is, however, not out of the woods yet. According to Recean, the deal stipulates that MET Gas will supply 3 million cubic metres of gas per day starting from February 13 for only 16 days. He revealed that Transdniestria rejected an EU offer of 60 million euros to fund gas purchases on the grounds that it would have required consumers to gradually pay more for gas. ""The inhabitants of the Transdniestria region will continue to live in a state of unpredictability and worry about gas supply,"" Recean said. ""It's a solution that doesn't solve the problem long term.""Europe’s gas inventories have continued to moderate, with the latest w/w draw of 3.72 billion cubic metres (bcm) at 96% of the five-year average draw. According to gas Infrastructure Europe (GIE) data, inventories stood at 61.85 bcm on 2 February, and are 19.05 bcm lower y/y and 6.77 bcm below the five-year average. European natural gas futures climbed toward €58 per megawatt-hour on Monday, the highest level since January 2023, as colder weather accelerates the drawdown of regional storage. By Alex Kimani for Oilprice.com

More Top Reads From Oilprice.comGoldman Sachs: U.S. Tariffs Will Have Short-Lived Limited Impact on Oil PricesOver 60% of IRA Investments Now At Trump’s MercyTesla Sales Fell 59% In Germany In January"
Feb 10 2025 12:00 PM ,Why Tesla Sales are Plummeting,"It’s hard to believe it was ever a controversial take, but a little over two years ago, I argued that Tesla’s market share was poised to decline due to Elon Musk’s behavior. I cited a range of factors—from intensifying competition and supply chain challenges to a less-discussed (at that time), but equally important, variable: Elon Musk’s controversial acquisition of Twitter. I predicted that his behavior on the platform would alienate the very customer base most likely to purchase an electric vehicle, eventually impacting Tesla sales.I suggested that it might take a bit of time, because Tesla didn’t have a lot of competition and many Tesla orders were already in the pipeline, but I thought his actions would eventually drive customers away.


Some critics at the time dismissed this view as overly sensational. One commenter called it a “stupid and one-sided analysis”, adding “This article makes it sound like Elon Musk is ruining Tesla with his Twitter-related actions, but revenues are still up every year.”Data Validates the WarningRecent data appears to validate my previous analysis.The latest figures indicate that even though the EV market grew last year, Tesla’s 2024 deliveries dropped double digits from 2023, confirming that the company has indeed lost momentum. It isn’t just the inevitable result of a rapidly expanding EV market where more models are emerging; there’s growing evidence that Musk’s actions have actively deterred potential buyers. Now, as Tesla’s latest quarterly numbers reveal a marked decline in deliveries, it’s becoming increasingly hard to ignore the impact of Musk’s public persona on the brand. While Tesla continues to maintain a robust revenue stream, the dilution of brand loyalty is evident. The California New Car Dealers Association (CNCDA) noted, “Things aren’t looking so golden for EV automaker Tesla in the Golden State. Tesla’s dominance in the electric vehicle market continues to falter as the brand reported its fifth consecutive quarterly registration decline. Tesla’s registrations fell 7.8 percent in Q4 2024, contributing to an overall 11.6 percent decline in 2024.”Impact of Musk’s Public PersonaWhen the company once enjoyed a near-mythical status as the undisputed leader of the EV revolution, its products were not only about performance and innovation but also about aspirational branding. Today, however, that narrative appears fractured by the growing politicization of Musk.Critics have argued that Tesla’s market share decline is the inevitable result of an expanding overall EV market, with traditional automakers and startups alike launching competitive models. Indeed, the numbers reflect that the overall market is growing, which in itself presents a challenge for any single company. 


Yet, there is more to the story. The loss in market share isn’t solely a byproduct of fierce competition or production constraints—it’s also a signal that consumers are reacting to leadership decisions that seem increasingly disconnected from core customer expectations.In retrospect, my previous analysis wasn’t just a contrarian take on market dynamics—it was a warning that corporate governance and brand stewardship matter immensely. Musk’s high-profile moves have shifted public discourse in ways that extend far beyond social media. The resulting erosion of trust among a segment of Tesla’s traditional customer base is now reflected in the declining delivery numbers despite an EV market that is still growing.Looking Ahead: Rebuilding the ConnectionAs the data unfolds, it’s clear that while Tesla still delivers impressive technological advancements, the company now faces a critical juncture. The challenge is not only to sustain innovation but to rebuild the connection with consumers that once fueled its meteoric rise. In the end, the evolving narrative around Tesla serves as a reminder: even the most dominant market players must heed the multifaceted demands of modern business—where product excellence, public perception, and leadership behavior all play crucial roles. Musk’s Twitter escapade was seen as peripheral by some, but as Tesla’s latest figures suggest, they’re proving to be a factor in the company’s current market performance.While Tesla’s share price remains robust, the decline in deliveries signals that its brand is under strain. This divergence underscores a critical reality: technological prowess alone no longer guarantees market dominance. Tesla now faces the formidable challenge of re-establishing a connection with its customers while maintaining its relentless pace of innovation. As investor sentiment begins to factor in the broader implications of leadership decisions and public perception, the coming quarters will be pivotal in determining whether Tesla can reverse the trend. By Robert Rapier

More Top Reads From Oilprice.comTrade Dispute Could Force U.S. to Buy Venezuelan Oil, Canada SaysTesla Sales Fell 59% In Germany In JanuaryIndia Set to Launch New Oil and Gas Bid Rounds"
Feb 10 2025 10:00 AM ,Net Zero Dreams Meet Energy Affordability Reality,"The pushback on the net zero ambitions of many countries has become increasingly evident since the energy crisis of 2022.The surge in energy prices, especially in Europe, has forced governments to address immediate concerns about the cost of living and high energy prices rather than gain more support for net-zero goals and policies.


Households and businesses are now much more focused on energy affordability than on clean energy. As a result, voters in the developed nations in recent months have chosen to punish the politicians during whose tenure energy prices spiked in the aftermath of the Russian invasion of Ukraine, which coincided with a rise in energy demand after the initial Covid lockdowns.  Sustainability and adoption of policies to advance net-zero goals were dominating energy policy and decision-making until the end of 2021.But in early 2022, the beginning of the war in Ukraine, the subsequent end of decade-old energy routes, and the spike in oil and gas prices upended the energy debate and policy.Of the so-called energy trilemma – security, affordability, and sustainability – security and affordability became more important for policymakers and for the voters than sustainability.The most zealous advocates of the energy transition, even the International Energy Agency (IEA), admitted that the net-zero ambitions – while not scaled back by governments – have been superseded by the issues of affordability and energy access.Related: Uruguay's Green Energy Success Story Takes an Unexpected Turn“Issues of affordability and fairness have moved towards the centre of debates about clean energy transitions in many countries,” the IEA said in a World Energy Outlook Special Report on affordable and fair energy last year.In the report, the IEA defended its current stance of a proud champion and promoter of net-zero goals and criticized those blaming the high cost of living on more clean energy being rolled out.


“When people misleadingly blame clean energy and climate policies for the recent spikes in energy prices, they are, intentionally or not, moving the spotlight away from the main cause – the major cuts that Russia made to natural gas supply,” said the IEA.But the agency acknowledged, “That said, there is still an important debate to be had about affordability and fairness in clean energy transitions – notably in terms of how the costs and benefits will be shared.”The benefits are mostly shared by well-to-do households in developed countries—they can afford the high upfront costs of installing heat pumps or solar panels and, generally, of electrifying their homes. On the other hand, these high upfront costs lockout low-income households, even in developed economies, out of the transition.The costs of net-zero and greener energy are shared by everyone, but poorer countries and households feel them the most as a proportion of their disposable income.As is, the energy transition isn’t fair, and energy isn’t a universally accessible service. There are hundreds of millions of people without any access to energy, and most of these are in Africa, Southeast Asia, and many other developing countries, which lack the funding for a step change in investments. Here’s where the developed economies are asked to step in, but they haven’t been able to agree on how exactly the rich will fund the poor for energy access and clean energy.Fairness and affordability, as well as energy security in an increasingly polarized world, are leading the energy debate now.Net-zero goals aren’t deferred, but they aren’t preferred, either.In the energy trilemma, sustainability has given way to affordability and security as the more pressing issues for both policymakers and energy consumers.Energy producers are also acknowledging that clean energy will need more time to become a profitable business than initially expected. Since the energy crisis of 2022, the big European oil and gas firms have reduced investments in low-carbon energy and pledged to boost oil and gas production, in yet another U-turn of strategic priorities.By Tsvetana Paraskova for Oilprice.com

More Top Reads From Oilprice.comGoldman Sachs: U.S. Tariffs Will Have Short-Lived Limited Impact on Oil PricesTrade Dispute Could Force U.S. to Buy Venezuelan Oil, Canada SaysTesla Sales Fell 59% In Germany In January"
