Date,Title,Articles
Feb 19 2025 9:00 AM ,G7 Seeks to Disrupt Russian Exports With Tighter Oil Price Cap,"The Group of Seven is looking to send a big anti-Russia message on Feb. 24, the three-year anniversary of Putin's invasion of Ukraine, with a potential tightening of an oil price cap intended to further hurt revenue for Russia's war machine.Bloomberg has revealed a G7 draft statement Tuesday calling for member nations to collectively redraw the price limit, which is currently set at $60 a barrel for crude oil. The document spells out pressure for Russia to ""incentivize it to negotiate a meaningful peace"" in Ukraine; however, it's anything but clear whether this is being called for in cooperation with Trump officials, who are engaged in direct talks with Moscow.


The draft at one point references ""troops and resources on the ground, coupled with robust international oversight to monitor agreed-upon lines,"" Bloomberg writes.But based on the wording, it does seem a last-ditch parallel effort to jump-start a peace arrangement with Moscow, as European nations in particular seek a 'seat at the table' - given both Zelensky and EU officials were completely cut out of Tuesday's meetings with Russian representatives in Saudi Arabia.According to more of the content:The draft indicates the allies would “recognize” Ukrainian President Volodymyr Zelenskiy’s “readiness to engage in talks to end the war,” while warning that Russian President Vladimir Putin’s terms for peace “have so far amounted to Ukraine’s complete capitulation.” The draft shows the allies are planning to meet with Zelenskiy on Feb. 24.Allies will call, according to the draft, for a “common sense peace that is fair, a peace that lasts,” which would entail “a durable security guarantee.”The initial oil price cap by the Western allies, first implemented in December 2022, proved too easy for Russia to work around, as India and China have remained the biggest buyers of Russian crude, and have proven not so compliant.The outgoing Biden administration in December then sought to ratchet sanctions on Russian oil, including sanctions on Surgutneftgas and Gazprom Neft, two Russian oil firms which together account for 25% of exports. Middlemen who supply Russian oil have also been targeted.


This new planned G7 initiative would aim to severely disrupt Russian oil exports to India and China, and if successful could give Trump's team more leverage in negotiations with Moscow. But Bloomberg also notes:The allies will maintain their line that any negotiation to end the war “must involve Ukraine’s full participation,” and leave it open to pursuing Euro-Atlantic integration.It’s hard to be sure what tightening or adapting the cap would look like in practice. While a lower price could be one option, another could be to try to bolster enforcement of the current measure.During a late Tuesday afternoon press Q&A from Mar-a-Lago, Trump blasted critics of his peace plan, saying ""I hear they're upset about not having a seat. Well, they've had a seat for three years."" This was in response to Ukrainians feeling 'betrayed' by being left out of current talks with Moscow.Meanwhile, there are reports saying Trump and Putin could finally meet face-to-face by month's end, as the sides potentially progress toward a firm deal.By Zerohedge.com

More Top Reads From Oilprice.comU.S. Fuel Prices Surge On Refinery Maintenance And OutagesRussia Claims to Be Fully Compliant with OPEC+ Output QuotaGoldman Sachs: Ukraine Peace Won’t Hike Russia’s Oil Supply"
Feb 17 2025 4:00 PM ,Oil Producers Exercise Caution Despite Policy Shifts,"Ahead of his second term, President Donald Trump revived the “Drill, Baby, Drill” slogan, reaffirming his commitment to boosting domestic oil production and reducing energy costs. This policy aims to enhance energy independence, drive economic growth, and lower fuel prices for consumers. However, despite the administration’s push for increased drilling, oil producers remain cautious, emphasizing that their decisions are primarily driven by market conditions rather than political rhetoric.


Market Dynamics and Industry ResponseWorking against Trump’s pro-drilling stance is an oil market that remains relatively stable. According to Deloitte’s 2025 Oil and Gas Industry Outlook, in 2024 oil prices traded within a range of $74 to $90 per barrel, leading energy companies to prioritize capital discipline and strategic investments over aggressive expansion.Liam Mallon, President of ExxonMobil’s Upstream division, recently reinforced this sentiment, stating: “A radical change in production is unlikely because the vast majority, if not everybody, is primarily focused on the economics of what they’re doing.” Mallon’s perspective reflects a broader industry trend—oil producers remain focused on financial sustainability rather than short-term production boosts.Economic Considerations and ProfitabilityThe decision to drill new wells is fundamentally tied to breakeven prices—the price at which oil companies can cover their production costs and remain profitable. According to the Dallas Fed Energy Survey, the breakeven price for new drilling projects ranged between $59 and $70 per barrel in 2024.With West Texas Intermediate (WTI) crude currently priced around $71 per barrel, new drilling remains modestly profitable but not lucrative enough to justify large-scale investment without clear demand signals. Many producers remain wary of overproduction, which could lead to another price downturn similar to those experienced in 2014 and 2020.OPEC+ Influence and Global Supply ConsiderationsAnother major factor influencing U.S. oil production is the role of OPEC+ in global supply management. The cartel’s coordinated production cuts have played a key role in maintaining stable oil prices, allowing U.S. producers to generate steady returns while discouraging excessive expansion. If OPEC+ were to increase output significantly—which they have done in the past—oil prices could dip below breakeven levels, making drilling far less attractive for U.S. companies.Additionally, global demand for oil is evolving, with energy transition policies promoting renewables and reducing long-term oil consumption projections. Some producers are hesitant to overinvest in drilling amid an uncertain demand outlook, preferring instead to focus on maintaining cash flow, shareholder returns, and measured production growth.Political and Regulatory ConsiderationsTrump’s policies seek to remove regulatory barriers to oil production, including streamlining federal permitting and reducing environmental restrictions. While these measures could lower costs for producers, they do not necessarily translate into immediate increases in drilling activity.


Regulatory relief can make operations more efficient, but as Scott Sheffield, former CEO of Pioneer Natural Resources, noted in a 2024 interview: “No company wants to risk another price collapse. We are disciplined now because we’ve learned from past cycles.” This sentiment highlights the industry’s cautious approach—prioritizing stability over speculative expansion.The Investment Case for U.S. Oil ProducersFor investors, the current environment presents both opportunities and risks. Many oil companies are prioritizing dividends and share buybacks over aggressive capital expenditures, making them particularly attractive for income-focused investors.Technological advancements, such as automated drilling and AI-driven well optimization, have significantly reduced operational costs, allowing producers to maintain profitability even at lower price points. Additionally, unlike in past cycles, U.S. producers have embraced capital discipline, reducing debt and improving financial stability, which could help mitigate risks associated with volatile oil prices.However, there are also key risks to consider. The ongoing global shift toward electric vehicles and renewable energy presents long-term demand uncertainties that could impact the industry’s future growth. Geopolitical risks also remain a factor, as conflicts in the Middle East, Russia, and other oil-producing regions could lead to price spikes or supply disruptions. Furthermore, future U.S. administrations could introduce stricter environmental regulations, affecting domestic production growth and potentially increasing operational costs for producers. As a result, investors must weigh these factors carefully when considering U.S. oil companies as part of their portfolio strategy.ConclusionWhile President Trump’s “Drill, Baby, Drill” slogan embodies an aggressive approach to increasing U.S. oil production, market forces remain the primary driver of industry decisions. Oil companies are responding not to political pressure but to price signals, profitability concerns, and shareholder priorities.As the global energy landscape evolves, the focus for U.S. producers will likely remain on capital discipline, operational efficiency, and strategic growth rather than an all-out drilling surge. For investors, this means looking beyond short-term political narratives and focusing on companies with strong balance sheets, efficient operations, and consistent shareholder returns.By Robert Rapier

More Top Reads From Oilprice.comTrump Administration Cuts Spark Chaos at Nuclear AgencyWhy China is Winning the Nuclear Energy RaceAnalysts Predict Gold to Reach $3,200 Later This Year"
Feb 17 2025 3:00 PM ,"Analysts Predict Gold to Reach $3,200 Later This Year","Gold prices have already increased 10 percent in 2025 to $2,900 (£2,300), but UBS has upgraded its target price for the precious metal again.UBS analyst Joni Teves said gold has had “unprecedented market dislocations” and reached a record high in 2024, but it’s only expected to move higher in 2025.


Teves explained that the gold market is currently experiencing “deep-rooted bullish sentiment,” with the metal seen as a safe-haven asset amid a highly uncertain and volatile macro environment.“After missing several buying opportunities in 2024, investors are likely wary of repeating the same patterns and may want to take advantage of corrections sooner this time around,” she said.Teves added that with uncertainty regarding tariffs, worries that stagflation may rear its head again, and continued global conflicts, the ‘safe haven’ of gold is likely to benefit.In addition, UBS expects stronger-than-expected official sector demand, such as through China’s pilot programme, which allows insurance companies to invest in gold, which provides important support to the market.The bank’s new forecasts predict that gold will climb to $3,200 later this year, then ease down slowly, ending 2025 above $3,000.UBS noted a continued lack of investor positioning toward the precious metal, “suggesting plenty of scope to add gold to portfolios.”


Alec Cutler, director at Orbis Investments, explained that despite the surging price of gold, Western investors have largely avoided rushing into the asset class.“The number of iShares and SPDR ETF investors has been dropping for the last two years… meaning gold’s rally so far is being driven by central banks and Asian investors,” he told City AM.He said that the strong returns of the Magnificent Seven, as well as the attractiveness of crypto, had been holding investors back from gold, but this would likely shift throughout the year.Therefore, Cutler predicted that gold’s rally would accelerate further once Western investors began investing in it.Meanwhile, the UBS analysts kept their forecasts for other precious metals, like silver and platinum, unchanged.While the analysts said the other metals have the potential to outperform gold from their current levels, silver suffers from higher volatility and lower investor conviction, while platinum interest could “stay muted” due to liquidity issues, leaving them reluctant to shift expectations.By City AM 

More Top Reads From Oilprice.comPrivately Financed Nuclear Project Advances in the UKTrump Administration Cuts Spark Chaos at Nuclear AgencyWhy China is Winning the Nuclear Energy Race"
Feb 15 2025 12:00 PM ,Trump's Energy Secretary Is Betting Big on Nuclear Power,"President Trump has doubled down on his pledges to allow for more fossil fuel production and reign in green funding since he came into office last month. He signed executive orders to allow for new oil and gas exploration and boost output, as well as restrict new renewable energy projects and halt a great deal of green funding. He declared a national energy emergency on 20th January, under the National Emergencies Act, largely in a bid to support fossil fuels and condemn renewable energy sources. However, perhaps surprisingly, his condemnation of clean energy does not appear to extend to nuclear power, which is expected to flourish under the Trump administration. Chris Wright, the Energy Secretary appointed by Trump, sees commercial nuclear energy as a key power source in the future of U.S. energy. Upon taking office, he listed his priorities, which included advanced nuclear power, fossil fuels, geothermal, and hydropower. Wright’s first Secretarial Order states, “The long-awaited American nuclear renaissance must launch during President Trump’s administration. As global energy demand continues to grow, America must lead the commercialisation of affordable and abundant nuclear energy. As such, the Department will work diligently and creatively to enable the rapid deployment and export of next-generation nuclear technology.” It also says, “The Department must also prioritise true technological breakthroughs – such as nuclear fusion.”


Maria Korsnick, President and CEO of the Nuclear Energy Institute, responded by saying, “We applaud the Senate’s confirmation of Chris Wright as Secretary of Energy. In this new role, Secretary Wright will play a pivotal role in furthering our nation’s energy and national security goals through prioritizing reliable, 24/7/365 energy generation, like clean nuclear energy. We look forward to working with Secretary Wright to continue our progress toward building the resilient, reliable, and affordable energy grid of the future.” Some expect Trump to back smaller-scale nuclear projects that are faster and cheaper to get up and running. During his presidential campaign in October, Trump pointed out in an interview with podcaster Joe Rogan that large-scale nuclear builds like Vogtle “get too big, and too complex and too expensive.” During his first term in office, Trump signed an executive order promoting the use of small modular reactors (SMRs) for national defence and space exploration. SMRs are viewed by many as the future of nuclear power as they can be developed cheaper and faster than conventional reactors and can be joined together to produce more power. Further, several non-traditional nuclear energy companies, including start-ups, without the capabilities to build large reactors are developing SMRs. The licensing process for SMRs is expected to be more streamlined than large-scale projects, allowing for faster deployment of nuclear energy across the U.S. This would help achieve Trump’s aim of providing more energy to data centres to support the rollout of complex technologies, such as artificial intelligence. Trump has also emphasised his support for national energy production and goods manufacturing. He recently requested that uranium be reclassified as a critical mineral, after the U.S. Geological Survey (USGS) dropped the nuclear metal from its critical minerals list in 2022 when it deemed uranium a “fuel mineral”, meaning it no longer qualified. In his “Unleashing American Energy”, Trump asks for uranium to be put back on the list, a move that would help unlock federal funding and fast-track permitting for domestic uranium projects.The U.S. began producing its first high-assay low-enriched uranium (HALEU) in 2023. The Biden administration supported the development of uranium projects following the Russian invasion of Ukraine and subsequent sanctions on Russian energy. Previously, the U.S. depended heavily on Russia for its HALEU, as the only commercial producer of the fuel. Centrus Energy Corp produced the first 20 kg of domestic HALEU as part of the U.S. Department of Energy’s (DoE) HALEU Demonstration project at an enrichment facility in Piketon, Ohio. Speaking about this achievement, Centrus President and CEO Daniel Poneman stated, “This critical milestone is essential to meeting the Department’s near-term HALEU needs while laying the groundwork for the full restoration of America’s lost domestic uranium enrichment capacity.”


The U.S. continues to import most of its uranium from Canada, Australia, Russia, Kazakhstan, and Uzbekistan because it is cheaper and more abundant. U.S. companies pay a combined $1 billion a year to Russia's state-owned nuclear agency, Rosatom, importing around 14 percent of U.S. uranium and 28 percent of U.S. enrichment services. However, with sanctions on Russian energy and the potential introduction of tariffs on Canadian products, Trump is expected to support the expansion of a domestic uranium industry.  Experience from President Trump’s first term in office, as well as decisions made in the first month of his second term, suggest that, unlike other clean energy sources, nuclear power might thrive under the Trump administration. In addition to fossil fuels, Trump has voiced his support for nuclear power and has appointed an Energy Secretary who favours the power source, suggesting that the sector may grow significantly as several states continue to back clean energy projects. By Felicity Bradstock for Oilprice.com 

More Top Reads From Oilprice.comTrump Tariffs Push EU-US Relations Into Uncharted WatersCoal Consumption Remains High in the United StatesConstruction Industry Navigates Trump Tariff Impacts on Steel Prices"
Feb 12 2025 3:00 PM ,Chris Wright's Energy Order Prioritizes Abundance,"On February 5, 2025, U.S. Secretary of Energy Chris Wright issued his first secretarial order titled “Unleashing the Golden Era of American Energy Dominance.” The order outlines a comprehensive plan to accelerate domestic energy production, modernize critical infrastructure, and simplify regulatory processes. It signals a renewed focus on ensuring energy abundance and bolstering innovation in the sector.Shifting Priorities: From Net-Zero to Energy AbundanceOne of the primary shifts outlined in the order is a move away from a focus on net-zero carbon policies. Rather than constraining energy production in pursuit of aggressive emissions targets, the new directive emphasizes “energy addition, not subtraction.” 


In practice, this means that the government will prioritize tapping into the vast resources of American energy. The aim is to lower energy costs for families and businesses by expanding production capabilities and reducing reliance on restrictive policies.Enhancing Research and DevelopmentCentral to the order is the call to “Unleash American Energy Innovation.” The Department of Energy is set to increase its research and development efforts, leveraging the expertise of the nation’s National Laboratories. The order calls for a comprehensive review of the DOE’s R&D portfolio, with an emphasis on technologies that can advance various energy sectors. These include advanced fossil fuel extraction methods, next-generation nuclear power, geothermal energy, and hydropower. By focusing on cost-effective, reliable, and secure energy technologies, the order aims to help maintain America’s competitive edge in the global energy market.Revisiting LNG ExportsAnother notable component of the order is the renewed focus on liquefied natural gas (LNG) exports. The order directs the Department to process pending applications for LNG exports in accordance with the Natural Gas Act. This measure is intended to reinforce the U.S.’s position as the world’s top LNG exporter, supporting domestic energy security and bolstering international relationships, particularly with European and Asian partners.Supporting Initiatives for a Robust Energy FutureBeyond these headline initiatives, the order addresses several other important areas:


Affordability and Consumer Choice: The DOE Appliance Standards Program will be reviewed to ensure that cost-benefit analyses accurately reflect consumer needs, aiming to prevent overly burdensome regulations that could limit choice.Strategic Petroleum Reserve (SPR): Recognizing the SPR as a key national asset, the order includes plans to refill the reserve and review its infrastructure to better safeguard this resource.Nuclear Energy and Stockpile Modernization: The order outlines continued efforts to modernize the nation’s nuclear stockpiles and promote the commercialization of next-generation nuclear power, balancing national security and energy production.Grid Reliability and Permitting: A renewed focus is placed on strengthening the electric grid and expediting permitting processes, with the goal of removing long-standing bottlenecks that have hindered private investment in energy infrastructure.A Measured Policy ShiftWhile the language of the order is ambitious, it is framed in a way that reflects a broader policy adjustment rather than a radical overhaul. The directive provides a detailed framework for overcoming regulatory obstacles and reassigning resources toward bolstering American energy production.This new policy direction comes at a time when the U.S. remains the leading global energy producer in oil, natural gas, and nuclear power. The initiatives outlined in the order aim to consolidate that leadership by reinforcing domestic production, streamlining regulatory oversight, and promoting continued technological innovation.Looking AheadAs the Department of Energy begins to implement these policies, the impact on production, cost efficiency, and market dynamics will become more apparent in the coming quarters. Ultimately, Secretary Wright’s order represents a measured effort to recalibrate the U.S. energy landscape. By addressing regulatory barriers and redirecting focus toward energy abundance and innovation, the policy framework aims to secure a resilient energy future that supports both economic growth and national security.By Robert Rapier

More Top Reads From Oilprice.comFailed Nuclear Deal Negotiations Push Iran Closer to Economic CollapseTariff Threats and Demand Shifts Impact Steel PricesBritain's Energy Future Hinges on Small Modular Reactors"
