Date,Title,Articles
Feb 19 2025 7:00 PM ,Canada Revives Old Oil Pipeline Ideas Amid U.S. Trade Spat,"The U.S. tariff threat was a wake-up call for Canadian policymakers that the federal and provincial governments may have too hastily scrapped over the past decade Alberta-to-coast pipeline projects that could have diversified Canada’s oil and gas exports.Everyone in Canada agrees that energy exports are the biggest leverage the country has in a trade war with its neighbor to the south.


Canada supplies around 60% of all U.S. oil imports. The oil province of Alberta alone supplies 56% of all U.S. oil imports—twice as much as Mexico, Saudi Arabia, and Iraq combined, Alberta Premier Danielle Smith says.But the heavy dependence on the United States for Canadian oil exports has rekindled talk about resuscitating previously abandoned Alberta-to-coast pipeline projects that would give Canada access to more markets.Over the past decade, only one pipeline made it through all the protests. The Trans Mountain Expansion Project, after it was abandoned by Kinder Morgan and purchased by the federal government, tripled the capacity of the original pipeline to 890,000 bpd from 300,000 bpd to carry crude from Alberta’s oil sands to British Columbia.For other projects, it’s all just talk for now. No company is officially proposing reviving any scrapped pipeline plan, but politicians outside of Alberta have started to realize that things could change as the rules of the game have changed.Related: Goldman Sachs: Ukraine Peace Won’t Hike Russia’s Oil SupplyThere has been talk of the scrapped projects Energy East, which would have delivered oil from Alberta east to Ontario and Quebec shores, and of Northern Gateway, which would have run from north of Edmonton in Alberta to Kitimat on British Columbia’s North Coast.These two projects were scrapped between 2016 and 2017. Back then, Canada’s federal government led by Justin Trudeau was rejecting oil and gas projects on environmental grounds. In addition, green activists’ opposition in provinces other than Alberta was killing off many attempts of Alberta-based oil producers and pipeline operators to have pipelines built to Canada’s shores—and not only those going straight south to the biggest refining centers in the U.S.With tariffs and trade war back on the table for Canada’s economy, politicians and pipeline industry executives say that the narrative has shifted.Earlier this month, Canada’s Industry Minister, François-Philippe Champagne, said that the country may need an Alberta-East Coast pipeline.“Things have changed … you cannot be in the past,” Champagne told CTV in an interview on February 9.


“We cannot be dependent,” the minister said.Canadians have increased their support for Alberta-to-coast pipelines. Public support to revive Energy East has jumped to 65% from 58% since 2019, with support in Quebec growing from 33% to 47%, a new poll from the non-profit Angus Reid Institute showed last week.Northern Gateway (Alberta to B.C.) generates the support of a slight majority of Canadians, with one-quarter opposing it. Notably, Northern Gateway generates 55% support in British Columbia, with 32% opposition, the polling showed.Among all Canadians, the majority, 63%, believe the economy would greatly benefit from the expansion of oil and gas pipeline capacity, according to the poll.Compared to 18 months ago, Canadians are now also nearly twice as likely to emphasize economic growth as a key factor in deciding energy policy, with a corresponding decline in the importance of environmental concerns, a separate Angus Reid Institute poll found last week.Canadian federal Natural Resources Minister Jonathan Wilkinson said earlier this month that Canada should consider a West-East pipeline as U.S. President Donald Trump’s tariffs threats exposed a “vulnerability” in Canada’s energy infrastructure.“There are some vulnerabilities that we did not actually believe existed. We should be reflecting on the vulnerabilities and deciding whether there are some things we should do,” Wilkinson said.Pipeline giants, however, are less enthusiastic—they had to cancel projects due to too much regulatory burden, opposition at federal and provincial level, and environmental campaigns against pipelines.Enbridge, which had its Northern Gateway proposed pipeline scrapped by the federal government in the 2010s, says that Canada needs real change in many aspects of its regulatory and approval processes.“For us to be willing to seriously consider reinvesting in a project like that, whether it's east or west or just west, we need to see real change on numerous fronts,” Enbridge’s president and CEO Greg Ebel said on the Q4 earnings call this month.“We would need to see real legislative change at the federal and provincial government level that specifically identifies major infrastructure projects like Northern Gateway as being in the national interest and therefore legally required,” Ebel said.Permitting changes and federal and provincial support for more energy would also help the potential revival of pipeline plans, the executive added, noting that there have been positive comments from Canada’s policymakers since the U.S. tariff threats.“They're saying the right things, but it's going to take real actions, laws, regulation to attract the capital in our view,” Ebel concluded.By Tsvetana Paraskova for Oilprice.com

More Top Reads From Oilprice.comBrazil Joins OPEC+Trump's No-Prisoners Approach to Iran-China Oil CrackdownU.S. Fuel Prices Surge On Refinery Maintenance And Outages"
Feb 19 2025 6:00 PM ,Energy Traders Reduce Risk Exposure Amid Trump Chaos,"U.S. President Donald Trump has kicked off his second term with a bang, launching the most systemic and aggressive makeover of the American government. Trump and his allies have moved at lightning speed to force out longtime civil servants by launching a legally suspect buyout program, firing federal prosecutors who worked on criminal cases against Trump, and even attempting to unilaterally shutter the foreign aid agency USAID.Trump’s new administrative strategy closely mirrors what Steve Bannon, former chief White House strategist at the start of the first Trump administration, described as ‘flooding the zone’. Flooding the zone is an attempt to disorientate other politicians and the media by announcing so many things in a short period that it becomes impossible to react and formulate a response to everything. And now commodity analysts at Standard Chartered have pointed out that oil markets are showing signs of disorientation in the face of the sheer volume of new policy positions by the Trump administration. According to StanChart, many energy traders have responded to this chaos by reducing their risk exposure.


Related: Goldman Sachs: Ukraine Peace Won’t Hike Russia’s Oil SupplyStanChart says the disorientation is manifesting in unusually low levels of volatility. According to the commodity experts, the 30-day realized annualised Brent volatility clocked in at 16.5% at settlement on 17 February, good for a 6-percentage point w/w decline and just 1.5 ppt above a 15-month low. StanChart says a volatility range of 35-45% might be considered as roughly normal for oil, while the recent 15-25% range is unusually low. It also shows in anemic price action and lack of direction. Realized volatility is now in the lowest 2% tail of the distribution of volatility over the past 10 years.Oil price changes have been very limited over the past three weeks, especially compared to the situation a year ago. According to StanChart, further disorientation is showing in the tendency of the market to stay close to familiar ranges; for example, front-month Brent has moved through $75.10 per barrel (bbl) on some point intra-day on 11 of the past 12 trading days. Likewise, speculative positioning has fallen back towards neutral, with StanChart’s proprietary crude oil money-manager positioning index falling 9.7 w/w to a +16.7, the lowest level so far in the current year. StanChart says that many traders have lost interest in trading fixed prices since the presidential inauguration and have made a relative shift towards trading on both basisspreads and time spreads.EU Gas Inventory DrawsEU gas inventory draws have remained unusually high, with daily draws exceeding their year-ago equivalents on 60 of the past 70 days. According to Gas Infrastructure Europe (GIE), inventories stood at 51.76 bcm on 16 February, good for a w/w draw of 5.19 bcm and considerably higher than the five-year average at 3.48 bcm. According to StanChart, were that ratio to be maintained, Europe will finish the withdrawal season with gas inventories at just 37.5 bcm; however, the analysts have predicted that the continent will finish the season with inventories at 40 bcm, leaving 65 bcm to be added by 1 November if the EU Commission’s 90% target is to be met.


European natural gas futures remain volatile, with prices hovering around €49 per megawatt-hour, as traders assess the urgent need to rebuild storage ahead of winter. Last week, Germany, France and Italy came up with a proposal to ease EU gas storage requirements in a bid to normalize the market. Under the current European Commission regulation mandates, all EU nations are required to refill their storage caverns to 90% capacity by November, with interim targets set for February, May, July, and September. EU gas storage is currently under 45% full, making it difficult to meet the requirement of 90% by November 1. That’s well below last year's 67% mark at a corresponding point and the 10-year average of 51% for the same period. The continent’s seasonal draw has been bigger than in the previous two winters due to colder weather, lower wind power generation due to low wind speeds and the termination of Russian gas imports via Ukraine.However, LNG flows from the United States to Europe and Asia are expected to remain elevated. With Europe’s demand for U.S. LNG likely to remain robust, StanChart has predicted that displaced flows due to the latest China tariffs on U.S. LNG are unlikely to become distressed. StanChart sees the tariffs cutting the flow of spot cargoes to China dramatically, with some flows under longer-term contracts likely to continue, depending on the nature of re-export clauses. The experts have warned that the biggest threat of these tariffs is the economics of future long-term contracts, including contracts amounting to at least 15 million tonnes per annum (mtpa) that have already been signed. However, the U.S. currently provides less than 6% of China's LNG imports, while China accounts for just 6% of U.S. exports. By Alex Kimani for Oilprice.com

More Top Reads From Oilprice.comBrazil Joins OPEC+Trump's No-Prisoners Approach to Iran-China Oil CrackdownU.S. Fuel Prices Surge On Refinery Maintenance And Outages"
Feb 19 2025 4:00 PM ,Can Uruguay Strike Black Gold? Offshore Drilling in Focus,"After decades of developing its renewable energy capacity, Uruguay is now looking to explore for oil and gas, having made no successful discoveries in the past. New hopes of offshore reserves have encouraged the government to welcome foreign oil majors into its waters to explore for crude, despite the potentially harmful environmental implications of these activities. Uruguay is located between Brazil, Argentina, and the South Atlantic Ocean. It has a population of around 3.4 million people and, despite being one of Latin America’s richest countries, around one in five children and adolescents continue to live in poverty. Like many countries around the globe, Uruguay is facing a cost-of-living crisis. 


In 2022, oil contributed 43.6 percent of Uruguay’s total energy supply, however, it accounted for just 8.9 percent of its total electricity generation. Uruguay imported 97.6 percent of its crude supply and, in 2023, Uruguay imported $1.07 billion of crude petroleum, making it the country’s most imported product. It imports around 50,000 bpd of crude, mainly from Nigeria, the United States, Brazil, and Argentina. Uruguay’s government is now aiming to make Uruguay more energy-independent in the coming years by looking into its fossil fuel potential. Somewhat late in the game, Uruguay is exploring its Atlantic waters for oil. Uruguay has never found oil on or offshore, but, its former neighbour Namibia – from when the continents were joined as part of Pangaea – recently struck black gold. While Namibia, in the southwest of Africa, is over 7,000 km away, the recent discovery of 11 billion barrels of crude offshore has made Uruguay hopeful that it might have similar luck. Santiago Ferro Castelli, an energy transition manager at the state-owned energy company Ancap, which is conducting the exploration activities, stated, “We have a very similar geology, very similar spaces.” Ancap estimates there is between a 3 and 23 percent probability that offshore areas will contain oil or gas. Uruguay’s government has awarded seven contracts for exploration projects to companies such as U.S.-based Apache, Argentina’s YPF and the U.K.’s Shell, with drilling expected to commence in 2026. All 120km2 of Uruguay’s offshore acreage will now be explored for crude. Eytan Uliel, the CEO of Challenger Energy, stated, “In less than 18 months [Uruguay] went from being unheard of [in the oil world] to being 100 percent licensed by some of the biggest companies in the world.” This move reflects the wave of exploration activities that have taken place across Latin America in recent years. Guyana has become a major area of exploration, with several international oil majors flocking to develop ‘low-carbon’ oil projects. Guyana’s neighbour Suriname has also garnered significant attention, with experts suggesting the region could replace Venezuela as Latin America’s main oil power. However, many are criticising the move, as Uruguay has made strides in green energy production for several years. In 2022, over 90 percent of the country’s electricity production came from renewable energy sources, which few countries can claim. It is surprising, given Uruguay’s track record with clean energy, that the government would pursue new oil and gas exploration activities. 


In the early 2000s, under former President Tabaré Vázquez, Uruguay was facing an energy crisis, relying heavily on neighbouring countries to import expensive oil to power the country. Vázquez enlisted the help of the physicist Ramón Méndez Galain to transform the country’s energy sector by developing its renewable energy capacity. Within a decade, Uruguay developed around 50 wind farms and rolled out hydropower projects across the country. At the time, many viewed green energy projects as too expensive or too intermittent, but the government persisted and eventually transformed the country’s power system. Galain explained, “No one believed we could do it. We needed new solutions. We needed to do things differently… Today, even members of that cabinet say to me: ‘When you were saying those things on TV in 2008, we were thinking, how are we going to explain this when we fail?’”In addition to fears of potentially undoing decades of hard work in terms of clean energy, some are concerned about the country’s lack of preparedness, having no history in oil and gas. There are no laws or regulations in place for the development of oil and gas projects, which leaves Uruguay open to be taken advantage of by foreign oil and gas companies unless the government establishes clear legislation before drilling commences. The government is, nonetheless, hopeful that developing an oil industry will help bolster the country’s economy. In addition, it hopes that energy companies pursuing oil and gas activities will also take an interest in Uruguay’s green energy offerings, as many international oil majors look to expand their portfolios. The may extend to nascent industries such as green hydrogen, as well as conventional renewable energy projects. By Felicity Bradstock for Oilprice.com 

More Top Reads From Oilprice.comMining Giant Glencore to Return $2.2 Billion to ShareholdersU.S. Aluminum Industry Navigates Tariff ChangesNegative Energy Prices Threaten Renewable Investment in Europe"
Feb 19 2025 1:00 PM ,Mining Giant Glencore to Return $2.2 Billion to Shareholders,"Glencore has launched a $1bn (£792m) share buyback programme despite recording a 16 per cent drop in adjusted earnings before interest, tax, deprecation and amortisation (EBITDA) in 2024.The firm’s EBITDA fell to $14.4bn, down from $17.1bn in 2023, while adjusted earnings before interest and tax (EBIT) fell by a third.


Despite the fall, the FTSE 100 mining giant announced today in its preliminary annual results that it will pay $2.2bn in shareholder returns through cash distributions and buybacks based on its performance in 2024.“The decline in adjusted operating profit, particularly within the Industrial segment, was mainly a function of lower average energy coal prices year over year,” said Glencore CEO Gary Nagle.“Prices are currently weak amid fears of soft Chinese demand and higher Indonesian output, and the effect of tariffs between Washington and Beijing are yet to become clear,” explained Russ Mould, investment director at AJ Bell.Glencore also operates in the nickel and lead spaces, and prices have struggled in these sectors over the last year.Analysts had been expecting a fall in operating profit in the firm’s results but are currently forecasting a rebound in the figure for 2025 thanks to a reduction in the volatility of commodity prices.Glencore’s stock price has fallen more than 10 per cent in the last year and 2.6 pe rcent since the start of 2025.


“Operationally, 2024 was a strong year for Glencore,” said Nagle. “Our Industrial assets delivered full year production numbers within their original guidance ranges, which together with the addition of EVR’s steelmaking coal volumes from July 2024, resulted in a four per cent growth in copper equivalent volumes year over year.”“Capital expenditure has been creeping up, but net debt is very low at $3.7bn and that could give Glencore room for some expansive strategic action,” added Mould.Last month, rumours emerged that Glencore was eyeing a merger with mining rival Rio Tinto, which would be one of the biggest transactions in the industry ever.The two firms are reportedly looking to join forces to better navigate the energy transition and secure access to metals necessary for renewable fuel.By City AM 

More Top Reads From Oilprice.comGoldman Sachs: Ukraine Peace Won’t Hike Russia’s Oil SupplyG7 Seeks to Disrupt Russian Exports With Tighter Oil Price CapTrump Suggests Ukraine Could Have Avoided War"
Feb 19 2025 12:00 PM ,Trump Suggests Ukraine Could Have Avoided War,"U.S. President Donald Trump seems to have blamed Volodymyr Zelenskyy for Moscow's invasion of Ukraine, saying he was “disappointed” that the Ukrainian president complained about being frozen out of U.S.-Russia talks in Saudi Arabia on ending the war.""Today I heard, oh, well, we weren't invited. Well, you've been there for three years,"" Trump said, referring to Ukraine. ""You should have never started it. You could have made a deal.""


Trump did not clarify what he meant, but he has often blamed the war on Ukraine's desire to join NATO. Experts say Russia's full-scale invasion was driven by Russian President Vladimir Putin's imperial ambitions rather than Ukraine's NATO ambition, which had little support from the West at the time.Speaking from his Mar-a-Lago home in Florida on February 18, Trump also said he now feels ""much more confident"" of reaching a deal to end the conflict in Ukraine.""I think I have the power to end this war,” he said at a news conference after the high-level talks in Riyadh attended by U.S. Secretary of State Marco Rubio and Russian Foreign Minister Sergei Lavrov.Trump also said he might meet Putin this month and that he would not oppose a European move to send peacekeeping troops to Ukraine, an idea discussed during a European summit in Paris on February 17.“If they want to do that I’m all for it,” said Trump, before adding that the United States has no plans to contribute troops to any contingent sent to Ukraine to provide security guarantees.Trump also said that Ukraine should hold elections, saying: ""That's not a Russia thing, that's something coming from me and coming from many other countries also.""Other U.S. officials have suggested that Ukraine could hold elections following a cease-fire deal and this would be “good for democracy.""But Ukraine’s constitution bars it from holding elections under martial law, which was imposed when Russia launched its full-scale invasion in February 2022 and continues to this day after repeated extensions.Ukrainian President Volodymyr Zelenskyy's five-year term was due to end in May 2024 after elections in March, and Putin has said he would not negotiate with Zelenskyy because he would not have the authority to sign a peace deal.


Earlier on February 18, after the talks in Riyadh, the first senior-level Washington-Moscow discussions since the 2022 invasion, Russia and the United States agreed to establish teams to negotiate a path to ending the war “as soon as possible,” Rubio said.The U.S. secretary of state also said the European Union “is going to have to be at the table at some point” because of the sanctions the bloc has imposed.Sanctions were imposed as a result of the conflict, he said, speaking in an interview with the Associated Press and CNN. “In order to bring an end to any conflict there has to be concessions made by all sides.”Rubio noted the need for improvements in how the U.S. and Russian embassies ""are able to work"" in order to create missions to support peace talks, bilateral relations, and cooperation more broadly.“If our diplomatic channels are broken, it’s going to be very difficult to consistently engage on a host of topics, including some unrelated irritants that could derail the broader talks on Ukraine,” Rubio said.He called for quick action on restoring ""normalcy"" at the embassies, adding that it would be “important to set the table for the other two things that we want to do.”Some European leaders, alarmed by the radical shift in U.S. policy toward relations with Russia, fear Washington will make serious concessions and rewrite the continent's security arrangement.U.S. national-security adviser Michael Waltz said any postwar peace guarantee would have to be ""European-led,"" echoing calls by U.S. officials for European allies to increase defense spending and praising Britain and France for ""talking about contributing more forcefully to Ukraine's security.""During the February 17 summit in Paris, European leaders expressed a willingness to offer security guarantees to Ukraine, but they warned that the level of such assurances would have to be based on Washington's participation in the event of a comprehensive peace agreement, something the U.S. president now seems to have poured cold water on.France is to host a second meeting on February 19 to discuss the war in Ukraine and European security. This time, Canada and other European countries not present at the earlier emergency summit will attend.By RFE/RL 

More Top Reads From Oilprice.comRussia Claims to Be Fully Compliant with OPEC+ Output QuotaGoldman Sachs: Ukraine Peace Won’t Hike Russia’s Oil SupplyG7 Seeks to Disrupt Russian Exports With Tighter Oil Price Cap"
